{
  "schema_version": 1,
  "updated_at": "2026-08-04T11:27:47Z",
  "claims": [
    {
      "claim_id": "OWN-R0-CTRL",
      "task_id": "R0-CTRL-001",
      "round_id": "R0",
      "session_id": "S-MASTER-001",
      "mode": "exclusive",
      "writable_globs": [
        "docs/finish-orchestration/**",
        "tools/finish-orchestration/**"
      ],
      "planned_paths": [
        "docs/finish-orchestration/MASTER_PLAN.md",
        "tools/finish-orchestration/orchestration.py"
      ],
      "concurrency_group": "R0-control-plane",
      "active": false,
      "claimed_at": "2026-08-03T04:18:18Z",
      "released_at": "2026-08-03T04:39:00Z",
      "notes": "Coordination-only ownership released after the verified Round 0 push."
    },
    {
      "claim_id": "OWN-R0A-INV",
      "task_id": "R0A-INV-001",
      "round_id": "R0A",
      "session_id": "S-MASTER-001",
      "mode": "exclusive",
      "writable_globs": [
        "docs/finish-orchestration/**",
        "docs/finish-tasks/**",
        "tools/finish-orchestration/**"
      ],
      "planned_paths": [
        "docs/finish-orchestration/state/inventory.json",
        "docs/finish-tasks/R0A-inventory/README.md",
        "docs/finish-orchestration/dashboard.md"
      ],
      "concurrency_group": "R0A-inventory",
      "active": false,
      "claimed_at": "2026-08-03T04:47:45Z",
      "released_at": "2026-08-03T05:30:16Z",
      "notes": "Coordination-only inventory/adoption ownership released after the verified Round 0A push."
    },
    {
      "claim_id": "OWN-R0A-HIST-CPU-TIP",
      "task_id": "R0A-ADOPT-CPU-TIP",
      "round_id": "R0A",
      "session_id": "S-SOL-CPU-TIP-LEGACY",
      "mode": "shared_sequential",
      "writable_globs": [
        "include/tecmo_gameplay_cpu_steering.h",
        "include/tecmo_gameplay_pretip.h",
        "src/tecmo_gameplay_cpu_steering.c",
        "src/tecmo_gameplay_pretip.c",
        "src/tecmo_gameplay_scene*.c",
        "src/asset_pack/tecmo_asset_pack_gameplay_pretip.c",
        "src/asset_pack/tecmo_asset_pack_source_map.c",
        "README.md",
        "PORTING.md",
        "AGENTS.md"
      ],
      "planned_paths": [
        "src/tecmo_gameplay_scene_actors.c",
        "src/tecmo_gameplay_scene_test_pretip.c"
      ],
      "concurrency_group": "historical-sequential-product",
      "active": false,
      "claimed_at": "2026-08-02T01:24:21Z",
      "released_at": "2026-08-02T15:18:42Z",
      "notes": "Reconstructed historical ownership. Work is already represented in main; claim is inactive and must not be reused."
    },
    {
      "claim_id": "OWN-R0A-HIST-TIP-VIS",
      "task_id": "R0A-ADOPT-TIP-VIS",
      "round_id": "R0A",
      "session_id": "S-SOL-TIP-VIS-LEGACY",
      "mode": "shared_sequential",
      "writable_globs": [
        "include/tecmo_gameplay_pretip.h",
        "src/tecmo_gameplay_pretip.c",
        "src/tecmo_gameplay_scene*.c",
        "src/tecmo_win32_keys.c",
        "src/asset_pack/tecmo_asset_pack_gameplay_pretip.c",
        "src/asset_pack/tecmo_asset_pack_source_map.c",
        "tools/New-TipoffVisualProof.ps1",
        "tools/Run-GameplayPreTipTests.ps1",
        "README.md",
        "PORTING.md",
        "AGENTS.md"
      ],
      "planned_paths": [
        "src/tecmo_gameplay_scene_render.c",
        "src/tecmo_cli_render_gameplay_checkpoint.c"
      ],
      "concurrency_group": "historical-sequential-product",
      "active": false,
      "claimed_at": "2026-08-02T03:25:25Z",
      "released_at": "2026-08-02T23:44:52Z",
      "notes": "Reconstructed historical sequential/shared-boundary ownership. Already represented in main."
    },
    {
      "claim_id": "OWN-R0A-HIST-AWAY",
      "task_id": "R0A-ADOPT-AWAY-FACING",
      "round_id": "R0A",
      "session_id": "S-SOL-AWAY-FACING-LEGACY",
      "mode": "exclusive",
      "writable_globs": [
        "src/tecmo_gameplay_scene_render.c",
        "src/tecmo_gameplay_scene_test_render_contract.c",
        "PORTING.md"
      ],
      "planned_paths": [
        "src/tecmo_gameplay_scene_render.c",
        "src/tecmo_gameplay_scene_test_render_contract.c"
      ],
      "concurrency_group": "historical-away-facing",
      "active": false,
      "claimed_at": "2026-08-02T23:57:34Z",
      "released_at": "2026-08-03T01:56:31Z",
      "notes": "Reconstructed focused historical ownership. Worktree/branch were removed after proof preservation."
    },
    {
      "claim_id": "OWN-R1-CPU-PLAY",
      "task_id": "R1-CPU-PLAY-LIFECYCLE",
      "round_id": "R1A",
      "session_id": "S-SOL-R1-GAMEPLAY-001",
      "mode": "exclusive",
      "writable_globs": [
        "include/tecmo_gameplay_cpu_*.h",
        "src/tecmo_gameplay_cpu_*.c",
        "src/asset_pack/tecmo_asset_pack_gameplay_cpu_*.c",
        "src/asset_pack/tecmo_asset_pack_gameplay_cpu_*.h",
        "tools/Run-GameplayCpuSteeringTests.ps1",
        "tools/gameplay-lab/**",
        "docs/finish-tasks/R1-cpu-play-lifecycle/**"
      ],
      "planned_paths": [
        "src/tecmo_gameplay_cpu_steering.c",
        "src/asset_pack/tecmo_asset_pack_gameplay_cpu_steering.c",
        "docs/finish-tasks/R1-cpu-play-lifecycle/README.md"
      ],
      "concurrency_group": "R1-gameplay-foundation",
      "active": false,
      "claimed_at": "2026-08-03T05:30:16Z",
      "released_at": "2026-08-03T11:18:38Z",
      "notes": "Released after terminal ad0f005 was Sol/QA accepted, fast-forwarded into the Sol branch, recorded as ready for Round 1 staging, and both CPU Lunas were unpinned."
    },
    {
      "claim_id": "OWN-R1-LIVE",
      "task_id": "R1-LIVE-FOUNDATION",
      "round_id": "R1A",
      "session_id": "S-SOL-R1-GAMEPLAY-001",
      "mode": "exclusive",
      "writable_globs": [
        "CMakeLists.txt",
        "include/tecmo_gameplay_scene.h",
        "include/tecmo_gameplay_scene_internal.h",
        "include/tecmo_gameplay_state.h",
        "include/tecmo_gameplay_movement.h",
        "include/tecmo_gameplay_live_*.h",
        "src/tecmo_gameplay_scene.c",
        "src/tecmo_gameplay_scene_actors.c",
        "src/tecmo_gameplay_scene_validation.c",
        "src/tecmo_gameplay_scene_test_internal.h",
        "src/tecmo_gameplay_scene_test_orchestrator.c",
        "src/tecmo_gameplay_scene_test_state_flow.c",
        "src/tecmo_gameplay_state.c",
        "src/tecmo_gameplay_movement.c",
        "src/tecmo_gameplay_live_*.c",
        "src/tecmo_cli_gameplay_core.c",
        "src/asset_pack/tecmo_asset_pack_gameplay_movement.c",
        "src/asset_pack/tecmo_asset_pack_gameplay_movement.h",
        "src/asset_pack/tecmo_asset_pack_source_map.c",
        "src/asset_pack/tecmo_asset_pack_source_map.h",
        "src/asset_pack/tecmo_asset_pack_import_layout.h",
        "tools/Run-GameplayMovementTests.ps1",
        "tools/Run-GameplaySceneTests.ps1",
        "docs/finish-tasks/R1-live-foundation/**",
        "src/tecmo_game.c",
        "src/tecmo_flow_test.c",
        "build.ps1"
      ],
      "planned_paths": [
        "src/tecmo_gameplay_scene.c",
        "src/tecmo_gameplay_scene_actors.c",
        "src/tecmo_gameplay_state.c",
        "docs/finish-tasks/R1-live-foundation/README.md",
        "src/tecmo_game.c",
        "src/tecmo_flow_test.c",
        "build.ps1"
      ],
      "concurrency_group": "R1-gameplay-foundation",
      "active": false,
      "claimed_at": "2026-08-03T05:30:16Z",
      "released_at": "2026-08-03T16:55:12Z",
      "notes": "Accepted LIVE chain is preserved at domain tip 222d75cfafa9153db1eb44492bf557f11b1a9091 and staging-ready. Claim released only after Sol/QA acceptance, ff-only domain integration, durable master checkpoint cf3b3a2, accepted Luna unpins, and clean-tree reconfirmation. Sequential TIP claim remains active and disjoint."
    },
    {
      "claim_id": "OWN-R1-TIP",
      "task_id": "R1-TIP-FIDELITY",
      "round_id": "R1",
      "session_id": "S-SOL-R1-GAMEPLAY-001",
      "mode": "exclusive",
      "writable_globs": [
        "include/tecmo_gameplay_pretip.h",
        "src/tecmo_gameplay_pretip.c",
        "src/tecmo_flow_test.c",
        "src/tecmo_gameplay_live_proof.c",
        "src/tecmo_gameplay_scene_render.c",
        "src/tecmo_gameplay_scene_test_pretip.c",
        "src/tecmo_gameplay_scene_test_render_contract.c",
        "src/tecmo_cli.c",
        "src/tecmo_cli_render_gameplay_checkpoint.c",
        "src/tecmo_asset_pack.c",
        "src/tecmo_win32_keys.c",
        "src/asset_pack/tecmo_asset_pack_gameplay_pretip.c",
        "src/asset_pack/tecmo_asset_pack_gameplay_pretip.h",
        "src/asset_pack/tecmo_asset_pack_source_map.c",
        "src/tecmo_gameplay_scene.c",
        "tools/New-TipoffVisualProof.ps1",
        "tools/Run-GameplayPreTipTests.ps1",
        "tools/Run-GameplaySceneTests.ps1",
        "docs/finish-tasks/R1-tip-fidelity/**"
      ],
      "planned_paths": [
        "src/tecmo_gameplay_pretip.c",
        "src/tecmo_flow_test.c",
        "src/tecmo_gameplay_live_proof.c",
        "src/tecmo_gameplay_scene.c",
        "src/tecmo_gameplay_scene_render.c",
        "src/tecmo_gameplay_scene_test_pretip.c",
        "src/asset_pack/tecmo_asset_pack_source_map.c",
        "docs/finish-tasks/R1-tip-fidelity/README.md"
      ],
      "concurrency_group": "R1-gameplay-foundation",
      "active": false,
      "claimed_at": "2026-08-03T05:30:16Z",
      "released_at": "2026-08-03T22:04:10Z",